{
  "$schema": "../schema/ciphertext-v1.schema.json",
  "spec": "spec/ciphertext-v1.md",
  "format": "kal:v1",
  "generator": "conformance/tools/gen_ciphertext_v1.py",
  "warning": "Published test keys. Never use this key material for real data.",
  "keys": {
    "key-a": {
      "version": 3,
      "key_id": "k_7SV221GG79B2V7T18T04YZHHZV",
      "algorithm": "AES-256-GCM",
      "material_hex": "3b92c8ae4f9a31f7b80135a7caaa9c8a086416a0c35a0823446324839ff7c073"
    },
    "key-b": {
      "version": 2147483647,
      "key_id": "k_6YS2WS620CJ9VKQJ2E5HEW106P",
      "algorithm": "AES-256-GCM",
      "material_hex": "22467618e22c4fe85bc9c65f21f5a56f855500d05a0aade7776b88e5e0a78d72"
    }
  },
  "valid": [
    {
      "id": "empty-plaintext-no-context",
      "description": "Zero-length plaintext, no context",
      "key": "key-a",
      "context_pairs": [],
      "nonce_hex": "1af83f123b121f97e317ebb9",
      "aad_hex": "6b616c3a76310000001c6b5f3753563232314747373942325637543138543034595a48485a560000000300000000",
      "ciphertext": "kal:v1:k_7SV221GG79B2V7T18T04YZHHZV:3:Gvg_EjsSH5fjF-u5l1CqlSYqI0b8r-ivsDtpHA",
      "plaintext_hex": ""
    },
    {
      "id": "phone-number-row-context",
      "description": "The README example",
      "key": "key-a",
      "context_pairs": [
        [
          "table",
          "customers"
        ],
        [
          "row",
          "42"
        ]
      ],
      "nonce_hex": "0982560ba49c03080c8578c9",
      "aad_hex": "6b616c3a76310000001c6b5f3753563232314747373942325637543138543034595a48485a56000000030000000200000003726f77000000023432000000057461626c6500000009637573746f6d657273",
      "ciphertext": "kal:v1:k_7SV221GG79B2V7T18T04YZHHZV:3:CYJWC6ScAwgMhXjJnbwv1IJpMvPLfeXYzTc7GZn9j_GX_smmafs",
      "plaintext_hex": "39383736353433323130"
    },
    {
      "id": "context-sorted-by-key-bytes",
      "description": "Pairs given unsorted; AAD sorts them; empty value",
      "key": "key-a",
      "context_pairs": [
        [
          "z",
          "1"
        ],
        [
          "a",
          "2"
        ],
        [
          "m",
          ""
        ]
      ],
      "nonce_hex": "40ef28bfa54a52ab83b2b6b1",
      "aad_hex": "6b616c3a76310000001c6b5f3753563232314747373942325637543138543034595a48485a56000000030000000300000001610000000132000000016d00000000000000017a0000000131",
      "ciphertext": "kal:v1:k_7SV221GG79B2V7T18T04YZHHZV:3:QO8ov6VKUquDsraxGSqBrJ8PrtsvOIfoPOq0cWaKQ8irrtQ",
      "plaintext_hex": "736f7274206d65"
    },
    {
      "id": "context-sort-is-bytewise",
      "description": "Uppercase sorts before lowercase",
      "key": "key-a",
      "context_pairs": [
        [
          "b",
          "1"
        ],
        [
          "B",
          "2"
        ],
        [
          "_",
          "3"
        ]
      ],
      "nonce_hex": "1c7fc5285918d2dabbe1a564",
      "aad_hex": "6b616c3a76310000001c6b5f3753563232314747373942325637543138543034595a48485a56000000030000000300000001420000000132000000015f000000013300000001620000000131",
      "ciphertext": "kal:v1:k_7SV221GG79B2V7T18T04YZHHZV:3:HH_FKFkY0tq74aVkwF6_VaEUjP-kswJblF5FXTX-uGk",
      "plaintext_hex": "63617365"
    },
    {
      "id": "utf8-plaintext-and-value",
      "description": "Malayalam text in plaintext and context value",
      "key": "key-a",
      "context_pairs": [
        [
          "name",
          "\u0d36\u0d30\u0d3f"
        ]
      ],
      "nonce_hex": "935ba93dd4e1dfd106dd447e",
      "aad_hex": "6b616c3a76310000001c6b5f3753563232314747373942325637543138543034595a48485a560000000300000001000000046e616d6500000009e0b4b6e0b4b0e0b4bf",
      "ciphertext": "kal:v1:k_7SV221GG79B2V7T18T04YZHHZV:3:k1upPdTh39EG3UR-P3taS_o8cNYUY-xVU0-RobLfJ5dTNFFR9VkoLVO7mg",
      "plaintext_hex": "e0b495e0b4b2e0b58de0b4b2e0b4b1"
    },
    {
      "id": "binary-plaintext-1kib",
      "description": "1024 bytes of binary data",
      "key": "key-a",
      "context_pairs": [
        [
          "file",
          "blob.bin"
        ]
      ],
      "nonce_hex": "b1236ae02301ca80977082a9",
      "aad_hex": "6b616c3a76310000001c6b5f3753563232314747373942325637543138543034595a48485a5600000003000000010000000466696c6500000008626c6f622e62696e",
      "ciphertext": "kal:v1:k_7SV221GG79B2V7T18T04YZHHZV:3:sSNq4CMByoCXcIKpeLbVOvYcbRUKinxrh3Z1nGBMfZP_I5j2STKHKOaPLYc8fxewEAsWPAVtaIcUTFI28v6P0TUsS7ziHz8cANx-CI30mMBbcFqpNoJekKu4xq9Ubnx4ZrKqHnY958UBclm671JfoJQXJm71Dzi7tEQxJ8TfaE3Hvsauf4zJaiVJrMb4RCrYa_vFnI_hbKw-ad7fvafYEY84Jk7fNr9kTg8lWrZrDHfKqbSqugVTDpBiTY5hM1JHtWWVrBM-P7CeKiOWG8Drsj4KGJZSj5qvtnpBjxDPXBtq4bbkxnZer7lkU1HBBG_V2HHama5b3OXFk8RjqYnVSrqHc2c4b9ksWHGB1mIphQSCAxdOdNIyJlTzy2rXSY07bvF380VfoKycUDbVf12ZtuPxPpEOfbW3obnSmYzyOP7cqhTa03J3YKKN7gs9dJ09SStxQ32WIZMbefcghpCaY3Ul-xEc3xJZROB-os7uoHBybJ0FzThXLENjqtDVGoxlHlOoF9PAqEhYf0E9Ikh5qAG5aKbnx-RM97pZ7vy4ySVXo-NWrSQMRQZvTUtu15ZFaPN-SNLEprhZ-qe1Ni7zQHogUaCZA1uLVf-Bom2qLHjLmG_-jeIN25V1Ce7WYwIhDpfXs2vhPAI2-mirXfJ0GwL5Gw1_4TxKgKlgByw4rbx66p5JBCFimam2mFhJm8mwlnrdkiit58gX2FnttHzy9uw5qbtV1lSuw-nKxJ2BhyrU5xGDZTnEikr3QNC0hJ5HDTfhWLxupSdTs7c3NPPQmpd7nH2lSg3pGkyNKZGbo0I_yHhAxhh_Hd0_4zltqu2_iaKQsaG1AZwapQjm-fjPSvglO9aiG-e7Lc8DFJp2on72ZpWL-edVGJ3H2X0dk6znEq5Jf52T0UqsvqBvq6_pCG0gMIc2_8yIg2JUgRE3e6KBxcEeBoL5HyiWwjijLGW2fmcFN7nmWN_59BqkHX68oIaGgr8TdDrYub6NGcWu_QYWxcM4tXtgyqfSMURfTTBApeX2koyEe5eDzzZbDd0WYLr-FIW6-0Z_ruq5WSoVKg76YMiH1BCNnnJxS9Z1HhOxJc10iIGDd8LywvpY4McnCHJ9mkF59tVzGDYU7_bNx4FpRWsB-fCXI8_xhWUkI2_-IY8DzDGFMsU5rM0_LT6PwQevEOD3oJsPzsyfK6IXpUq3vFoXo8MLWA3_yM-BqupM5_t1WQmCuaQMgPztVg37-NImg2EgSKfHdtHxn6H6hMDJRQKmgPs61OS9IlQHW7Alv4q1HuFbNhavGWbPxft4ce5UnxJMWqest_GVoXkfoNrhHCg57W765-K3EMl1nX-CfFOQSZToENcIP_umYYyTcOKyDsLIkVplt9cLsAkugBMyTP8c2RlnRfLe1Sk",
      "plaintext_hex": "237cab181a98bca9b299dab2c98e5612b58dde7fbb8ceee5b37eda16dfd3f1599efdcfb03d8efa49e4641a3ef4233da0416e2fc88f0c5a8204b2f1fa3e1de8c6359d18e91286bad8cdbe0824ff9146742d4f690bbeed1446de252ec8f7880f5c061eb3e038b2e6061d48ebfa8aa9c4918a03a91675a834838376dd2848cc3bc78f8720ce2c0eed39eb784fab2be8328a6c055c67d86fd4f0c45046925ada2f8fde790d1521c5fb402a2bc158232b6b15a724023d4ed695a225fa3ce1a7ac1d331b0053c743f1f037a2b780eeeee75f79751553832209b40c6211541a4428a7c8c5f3a96fbc84a64f1da17e5d7ca482898fa1e4ca4dc734cbcc95e86a5de00c61aad6f73438916e610fe5d9f4dae407dab3c509a27a5687fe1008e73c9fe41c591785cdf427c0b033e56673dba4796a8011635d3b66a7784d327ad49aaffce93fb8ce9f276efc3d4ed4c3ec4df406e50eb651b21a5813c324efe4a2cb09618c2eefbaf1eadfa3c552402eb606865384998ba9e53ef144f968f756b579ef8a9e7d4ed2c46d076f19b1cb6890b64ec704e6049bf0c9cf189ff6ec5aca9e8fde364f013bd6016336be4fe3de83928c96d330f3edc761618638dd30d5bdb5eb75d2af9516457a87df6c566ae52f2a35614b72c15bb1b3589737b61bbda79a9f276eaf27d92384b9423e59c81615a829a62c5b121e205700d5f4544e3e3bc601c85713f18a7907ca47c74fe16019d39039a227bb42b37990cc04e7117b1683d9433c9a6339f27b445f3d8dd6fc062cf9b216301a74bbb2a46d3a98b8bb43524b325698e2115e9bbb10df30c22a7d3bdc2391fab5632560ac7e46831e0fa38145ae6ecec9355fd5edc1fa370ff97f90fbda170ac6bdfecbc1669f4b13362c9b398657eceb8113c6f47771279ba6780355c8ee41c99d365983fde8f0fada40084c98e0f9868f3f49ff5a6073b8c8820579f03ee8c2566502821bf986a46d8e01e30af84419da9312f61ba2ec43ad9709fde896fae95709a0632157136e47a61ba1cd4d1b2f062e017b5f2050d6b994ab3c33893916ecab10171ed99689a75b90d5cffb6ad9f905730fd23dd627e93fb8de3e8a546787d6895391435ccf7766e7b7c487f162a6fe3cf31d3316c1f01a67ed078f392dafb06b4c4a438eff598220d9fcc4430076a450aa7ab7bb09aa20193b2b67e9cd4c169fd6837db1690c38d4a35419bd4f03012108b387c05d062f64435f3011c88f1e286698b66987e35982676d699b04ee16a39cba736b0c0d21b110980494e7724d4de4fa884217ddbd7d4b11bf4ee85b7667423dbb1eb4a494433d28a4df6e49a1d6ead167300cc6ba63b578970ad9736bb9477b42362c78fdb92a270c7d3e55aecdad128b8f87389db1b2cd79baec1f9a4f13de4752da6cbbb1c5056d2983ab85e57837a2d99e5f537831e53c22"
    },
    {
      "id": "max-version",
      "description": "Largest allowed key version",
      "key": "key-b",
      "context_pairs": [],
      "nonce_hex": "9a677ec8403a7a21295c933e",
      "aad_hex": "6b616c3a76310000001c6b5f365953325753363230434a39564b514a324535484557313036507fffffff00000000",
      "ciphertext": "kal:v1:k_6YS2WS620CJ9VKQJ2E5HEW106P:2147483647:mmd-yEA6eiEpXJM-yrTA2BFu_LAVL6SXgltC6ndbrONqyiejkTqx",
      "plaintext_hex": "6d61782076657273696f6e"
    },
    {
      "id": "context-at-limits",
      "description": "16 pairs, 64-byte key, 256-byte value",
      "key": "key-b",
      "context_pairs": [
        [
          "k00",
          "v"
        ],
        [
          "k01",
          "v"
        ],
        [
          "k02",
          "v"
        ],
        [
          "k03",
          "v"
        ],
        [
          "k04",
          "v"
        ],
        [
          "k05",
          "v"
        ],
        [
          "k06",
          "v"
        ],
        [
          "k07",
          "v"
        ],
        [
          "k08",
          "v"
        ],
        [
          "k09",
          "v"
        ],
        [
          "k10",
          "v"
        ],
        [
          "k11",
          "v"
        ],
        [
          "k12",
          "v"
        ],
        [
          "k13",
          "v"
        ],
        [
          "k14",
          "v"
        ],
        [
          "KKKKKKKKKKKKKKKKKKKKKKKKKKKKKKKKKKKKKKKKKKKKKKKKKKKKKKKKKKKKKKKK",
          "xxxxxxxxxxxxxxxxxxxxxxxxxxxxxxxxxxxxxxxxxxxxxxxxxxxxxxxxxxxxxxxxxxxxxxxxxxxxxxxxxxxxxxxxxxxxxxxxxxxxxxxxxxxxxxxxxxxxxxxxxxxxxxxxxxxxxxxxxxxxxxxxxxxxxxxxxxxxxxxxxxxxxxxxxxxxxxxxxxxxxxxxxxxxxxxxxxxxxxxxxxxxxxxxxxxxxxxxxxxxxxxxxxxxxxxxxxxxxxxxxxxxxxxxxxxxxxxx"
        ]
      ],
      "nonce_hex": "e922346247151ce7ca897181",